<!DOCTYPE invoice SYSTEM "invoice.dtd"><invoice><customer><customerno>2</customerno><customername>Somu</customername><customeraddress>Delhi</customeraddress><customeremail>somu@gmail.com</customeremail><customerphone>9876512340</customerphone></customer><items><item><itemno>1001</itemno><itemdescription>Parle - G</itemdescription><itemunit>1 pkt</itemunit><itemprice>10</itemprice><itemqty>2</itemqty><itemtotal>20.0</itemtotal></item><item><itemno>1005</itemno><itemdescription>Milk</itemdescription><itemunit>1/2 Litre</itemunit><itemprice>25</itemprice><itemqty>5</itemqty><itemtotal>125.0</itemtotal></item></items><invdetails><invno>103</invno><date>23-03-2021 07:36:30</date><total>145.0</total></invdetails></invoice>