<!DOCTYPE invoice SYSTEM "invoice.dtd"><invoice><customer><customerno>1</customerno><customername>Somu</customername><customeraddress>Chennai</customeraddress><customeremail>somu@gmail.com</customeremail><customerphone>9876543210</customerphone><invoiceno>104</invoiceno></customer><items><item><itemno>1005</itemno><itemdescription>Milk</itemdescription><itemprice>25</itemprice><itemqty>4</itemqty><itemunit>1/2 Litre</itemunit><itemtotal>100</itemtotal></item><item><itemno>1004</itemno><itemdescription>Tomato</itemdescription><itemprice>100</itemprice><itemqty>3</itemqty><itemunit>1kg</itemunit><itemtotal>300</itemtotal></item><item><itemno>1003</itemno><itemdescription>Onion</itemdescription><itemprice>150</itemprice><itemqty>2</itemqty><itemunit>1kg</itemunit><itemtotal>300</itemtotal></item></items></invoice>