<!DOCTYPE invoice SYSTEM "invoice.dtd"><invoice><customer><customerno>4</customerno><customername>Gokul Prakash</customername><customeraddress>Chennai</customeraddress><customeremail>gokulprakash22@gmail.com</customeremail><customerphone>+918946069629</customerphone></customer><items><item><itemno>1003</itemno><itemdescription>Onion</itemdescription><itemunit>1kg</itemunit><itemprice>150</itemprice><itemqty>2</itemqty><itemtotal>300.0</itemtotal></item><item><itemno>1006</itemno><itemdescription>Orange</itemdescription><itemunit>1kg</itemunit><itemprice>100</itemprice><itemqty>3</itemqty><itemtotal>300.0</itemtotal></item><item><itemno>1001</itemno><itemdescription>Parle-G</itemdescription><itemunit>1pkt</itemunit><itemprice>10</itemprice><itemqty>1</itemqty><itemtotal>10.0</itemtotal></item><item><itemno>1002</itemno><itemdescription>MilkBikis</itemdescription><itemunit>1pkt</itemunit><itemprice>10</itemprice><itemqty>1</itemqty><itemtotal>10.0</itemtotal></item></items><invdetails><invno>145</invno><date>2021-03-31</date><total>620.0</total></invdetails></invoice>