<!DOCTYPE invoice SYSTEM "invoice.dtd"><invoice><customer><customerno>2</customerno><customername>Mani</customername><customeraddress>Delhi</customeraddress><customeremail>mani@gmail.com</customeremail><customerphone>9876501234</customerphone></customer><items><item><itemno>1002</itemno><itemdescription>MilkBikis</itemdescription><itemunit>1 pkt</itemunit><itemprice>10</itemprice><itemqty>2</itemqty><itemtotal>20.0</itemtotal></item><item><itemno>1001</itemno><itemdescription>Parle - G</itemdescription><itemunit>1 pkt</itemunit><itemprice>10</itemprice><itemqty>2</itemqty><itemtotal>20.0</itemtotal></item></items><invdetails><invno>105</invno><date>2021-03-22</date><total>40.0</total></invdetails></invoice>